{
  "mode": "article_visualization",
  "article_slug": "sample-article",
  "character_id": "default",
  "text_strategy": "overlay_after_generation",
  "style_profile": {
    "canvas": "16:9 horizontal article illustration",
    "line": "hand-drawn black line art",
    "background": "mostly white background"
  },
  "shots": [
    {
      "id": "01",
      "placement": "hero",
      "anchor_type": "process",
      "theme": "Textless-first 文章配圖方法",
      "core_idea": "很多中文文章配圖不是缺畫面，而是缺一個穩定流程。不能把中文標籤交給圖像模型直接畫，因為錯字、幻覺標題和多餘貼紙語會讓整張圖失控。",
      "structure_type": "workflow",
      "metaphor": "a low-tech conveyor path moving from article notes to a blank image and then to labeled output",
      "character_action": "handoff",
      "visual_prompt_file": "prompts/01.generated.visual.md",
      "overlay_file": "overlays/01.generated.overlay.json",
      "textless_image": "textless/01.textless.png",
      "final_image": "final/01.final.png",
      "qa_status": "pending"
    },
    {
      "id": "02",
      "placement": "body",
      "anchor_type": "process",
      "theme": "對比：不是把字畫進去",
      "core_idea": "傳統做法是要求模型在畫面裡寫上「結論」「下一步」這類詞。但更穩的做法是先生成沒有可讀中文的圖，再用 overlay JSON 把文字放到明確座標。這不是 A 好 B 壞，而是把不穩",
      "structure_type": "workflow",
      "metaphor": "a low-tech conveyor path moving from article notes to a blank image and then to labeled output",
      "character_action": "handoff",
      "visual_prompt_file": "prompts/02.generated.visual.md",
      "overlay_file": "overlays/02.generated.overlay.json",
      "textless_image": "textless/02.textless.png",
      "final_image": "final/02.final.png",
      "qa_status": "pending"
    },
    {
      "id": "03",
      "placement": "body",
      "anchor_type": "process",
      "theme": "流程：先圖像，後文字",
      "core_idea": "pipeline 可以很簡單：先讀文章，找出值得視覺化的段落，產生 shot list，再生成 textless visual prompt，接著供應或產生無字圖片，最後用 ove",
      "structure_type": "workflow",
      "metaphor": "a low-tech conveyor path moving from article notes to a blank image and then to labeled output",
      "character_action": "handoff",
      "visual_prompt_file": "prompts/03.generated.visual.md",
      "overlay_file": "overlays/03.generated.overlay.json",
      "textless_image": "textless/03.textless.png",
      "final_image": "final/03.final.png",
      "qa_status": "pending"
    },
    {
      "id": "04",
      "placement": "body",
      "anchor_type": "contrast",
      "theme": "系統瓶頸：文字渲染是一台卡住的機器",
      "core_idea": "真正的瓶頸不是畫不出圖，而是模型常把短標籤渲染成錯字。這個系統局部需要被隔離：圖像模型只負責低科技隱喻和留白，文字渲染交給 deterministic renderer。",
      "structure_type": "before_after",
      "metaphor": "two worktables comparing unstable in-image text with stable overlay labels",
      "character_action": "sort",
      "visual_prompt_file": "prompts/04.generated.visual.md",
      "overlay_file": "overlays/04.generated.overlay.json",
      "textless_image": "textless/04.textless.png",
      "final_image": "final/04.final.png",
      "qa_status": "pending"
    },
    {
      "id": "05",
      "placement": "body",
      "anchor_type": "layering",
      "theme": "方法分層：schema、policy、QA",
      "core_idea": "方法要分層：schema 定義 manifest 和 overlay，policy 禁止 OCR 與自動定位，QA 檢查文字是否越界、是否空白、是否過長。每一層只做自己的工作。",
      "structure_type": "method_layering",
      "metaphor": "stacked trays labeled only as blank placeholders for schema, policy, and QA layers",
      "character_action": "stack",
      "visual_prompt_file": "prompts/05.generated.visual.md",
      "overlay_file": "overlays/05.generated.overlay.json",
      "textless_image": "textless/05.textless.png",
      "final_image": "final/05.final.png",
      "qa_status": "pending"
    }
  ]
}